B3: Third Dipsea Boy Invitational Cross County Race Results
D5: Clock | E5: Up | G5: Down | J5: Actual | L5: Division
B6: Place | D6: Time | E6: Time | F6: Place | G6: Time | H6: Place | I6: Head Start | J6: Time | K6: Place | M6: Place
B7: 1 | C7: Jamie Berns | D7: =J7-I7 -> 5.8240740740740725E-2 | E7: 3.953703703703703E-2 | F7: =RANK(E7,E$7:E$36,1) -> 2 | G7: 2.9120370370370366E-2 | H7: =RANK(G7,G$7:G$36,1) -> 2 | I7: 1.0416666666666666E-2 | J7: =E7+G7 -> 6.8657407407407389E-2 | K7: =RANK(J7,J$7:J$36,1) -> 2 | L7: women | M7: 1
B8: 1 | C8: Roy Rivers | D8: =J8-I8 -> 5.8240740740740739E-2 | E8: 3.1956018518518516E-2 | F8: =RANK(E8,E$7:E$36,1) -> 1 | G8: 2.6284722222222223E-2 | H8: =RANK(G8,G$7:G$36,1) -> 1 | I8: 0 | J8: =E8+G8 -> 5.8240740740740739E-2 | K8: =RANK(J8,J$7:J$36,1) -> 1 | L8: men | M8: 1
B9: 3 | C9: Judy Rabinowitz | D9: =J9-I9 -> 6.4988425925925922E-2 | E9: 4.0381944444444443E-2 | F9: =RANK(E9,E$7:E$36,1) -> 5 | G9: 3.5023148148148144E-2 | H9: =RANK(G9,G$7:G$36,1) -> 6 | I9: 1.0416666666666666E-2 | J9: =E9+G9 -> 7.5405092592592593E-2 | K9: =RANK(J9,J$7:J$36,1) -> 6 | L9: women | M9: 2
B10: =B9+1 -> 4 | C10: Brad Rippe | D10: =J10-I10 -> 7.2511574074074076E-2 | E10: 4.099537037037037E-2 | F10: =RANK(E10,E$7:E$36,1) -> 7 | G10: 3.1516203703703706E-2 | H10: =RANK(G10,G$7:G$36,1) -> 3 | I10: 0 | J10: =E10+G10 -> 7.2511574074074076E-2 | K10: =RANK(J10,J$7:J$36,1) -> 3 | L10: men | M10: 2
B11: =B10+1 -> 5 | C11: Chris Greene | D11: =J11-I11 -> 7.2534722222222209E-2 | E11: 3.9606481481481479E-2 | F11: =RANK(E11,E$7:E$36,1) -> 3 | G11: 3.2928240740740737E-2 | H11: =RANK(G11,G$7:G$36,1) -> 4 | I11: 0 | J11: =E11+G11 -> 7.2534722222222209E-2 | K11: =RANK(J11,J$7:J$36,1) -> 4 | L11: men | M11: 3
B12: =B11+1 -> 6 | C12: Rob Flatland | D12: =J12-I12 -> 7.4212962962962967E-2 | E12: 3.9849537037037037E-2 | F12: =RANK(E12,E$7:E$36,1) -> 4 | G12: 3.4363425925925929E-2 | H12: =RANK(G12,G$7:G$36,1) -> 5 | I12: 0 | J12: =E12+G12 -> 7.4212962962962967E-2 | K12: =RANK(J12,J$7:J$36,1) -> 5 | L12: men | M12: 4
B13: =B12+1 -> 7 | C13: Tomas Pastalka | D13: =J13-I13 -> 7.7789351851851846E-2 | E13: 4.0810185185185185E-2 | F13: =RANK(E13,E$7:E$36,1) -> 6 | G13: 3.6979166666666667E-2 | H13: =RANK(G13,G$7:G$36,1) -> 10 | I13: 0 | J13: =E13+G13 -> 7.7789351851851846E-2 | K13: =RANK(J13,J$7:J$36,1) -> 7 | L13: men | M13: 5
B14: =B13+1 -> 8 | C14: Dave Covey | D14: =J14-I14 -> 7.8414351851851846E-2 | E14: 4.3043981481481482E-2 | F14: =RANK(E14,E$7:E$36,1) -> 9 | G14: 3.5370370370370365E-2 | H14: =RANK(G14,G$7:G$36,1) -> 7 | I14: 0 | J14: =E14+G14 -> 7.8414351851851846E-2 | K14: =RANK(J14,J$7:J$36,1) -> 8 | L14: men | M14: 6
B15: =B14+1 -> 9 | C15: Diane Prater | D15: =J15-I15 -> 7.8587962962962957E-2 | E15: 4.8657407407407406E-2 | F15: =RANK(E15,E$7:E$36,1) -> 22 | G15: 4.0347222222222222E-2 | H15: =RANK(G15,G$7:G$36,1) -> 17 | I15: 1.0416666666666666E-2 | J15: =E15+G15 -> 8.9004629629629628E-2 | K15: =RANK(J15,J$7:J$36,1) -> 20 | L15: women | M15: 3
B16: =B15+1 -> 10 | C16: Peter Badertscher | D16: =J16-I16 -> 8.1030092592592584E-2 | E16: 4.5150462962962962E-2 | F16: =RANK(E16,E$7:E$36,1) -> 14 | G16: 3.5879629629629629E-2 | H16: =RANK(G16,G$7:G$36,1) -> 9 | I16: 0 | J16: =E16+G16 -> 8.1030092592592584E-2 | K16: =RANK(J16,J$7:J$36,1) -> 9 | L16: men | M16: 7
B17: =B16+1 -> 11 | C17: George Frazier | D17: =J17-I17 -> 8.1215277777777775E-2 | E17: 4.8020833333333339E-2 | F17: =RANK(E17,E$7:E$36,1) -> 20 | G17: 4.3611111111111107E-2 | H17: =RANK(G17,G$7:G$36,1) -> 22 | I17: 1.0416666666666666E-2 | J17: =E17+G17 -> 9.1631944444444446E-2 | K17: =RANK(J17,J$7:J$36,1) -> 24 | L17: Dipsea Boy | M17: 1
B18: =B17+1 -> 12 | C18: David Leipsic | D18: =J18-I18 -> 8.2824074074074078E-2 | E18: 4.5092592592592594E-2 | F18: =RANK(E18,E$7:E$36,1) -> 13 | G18: 3.7731481481481484E-2 | H18: =RANK(G18,G$7:G$36,1) -> 12 | I18: 0 | J18: =E18+G18 -> 8.2824074074074078E-2 | K18: =RANK(J18,J$7:J$36,1) -> 10 | L18: men | M18: 8
B19: =B18+1 -> 13 | C19: Greg Nacco | D19: =J19-I19 -> 8.2847222222222211E-2 | E19: 4.2835648148148144E-2 | F19: =RANK(E19,E$7:E$36,1) -> 8 | G19: 4.0011574074074074E-2 | H19: =RANK(G19,G$7:G$36,1) -> 16 | I19: 0 | J19: =E19+G19 -> 8.2847222222222211E-2 | K19: =RANK(J19,J$7:J$36,1) -> 11 | L19: men | M19: 9
B20: =B19+1 -> 14 | C20: Robert Dick | D20: =J20-I20 -> 8.3854166666666674E-2 | E20: 4.4641203703703704E-2 | F20: =RANK(E20,E$7:E$36,1) -> 12 | G20: 3.9212962962962963E-2 | H20: =RANK(G20,G$7:G$36,1) -> 15 | I20: 0 | J20: =E20+G20 -> 8.3854166666666674E-2 | K20: =RANK(J20,J$7:J$36,1) -> 12 | L20: men | M20: 10
B21: =B20+1 -> 15 | C21: Jed Tukman | D21: =J21-I21 -> 8.666666666666667E-2 | E21: 5.0844907407407408E-2 | F21: =RANK(E21,E$7:E$36,1) -> 27 | G21: 3.5821759259259262E-2 | H21: =RANK(G21,G$7:G$36,1) -> 8 | I21: 0 | J21: =E21+G21 -> 8.666666666666667E-2 | K21: =RANK(J21,J$7:J$36,1) -> 13 | L21: men | M21: 11
B22: =B21+1 -> 16 | C22: Ken White | D22: =J22-I22 -> 8.7395833333333339E-2 | E22: 4.6770833333333338E-2 | F22: =RANK(E22,E$7:E$36,1) -> 15 | G22: 4.0625000000000001E-2 | H22: =RANK(G22,G$7:G$36,1) -> 19 | I22: 0 | J22: =E22+G22 -> 8.7395833333333339E-2 | K22: =RANK(J22,J$7:J$36,1) -> 14 | L22: men | M22: 12
B23: 16 | C23: Gordon Wright | D23: =J23-I23 -> 8.7395833333333339E-2 | E23: 4.6840277777777779E-2 | F23: =RANK(E23,E$7:E$36,1) -> 16 | G23: 4.0555555555555553E-2 | H23: =RANK(G23,G$7:G$36,1) -> 18 | I23: 0 | J23: =E23+G23 -> 8.7395833333333339E-2 | K23: =RANK(J23,J$7:J$36,1) -> 14 | L23: men | M23: 12
B24: 18 | C24: Mark Stevens | D24: =J24-I24 -> 8.850694444444443E-2 | E24: 4.7789351851851847E-2 | F24: =RANK(E24,E$7:E$36,1) -> 19 | G24: 4.071759259259259E-2 | H24: =RANK(G24,G$7:G$36,1) -> 20 | I24: 0 | J24: =E24+G24 -> 8.850694444444443E-2 | K24: =RANK(J24,J$7:J$36,1) -> 16 | L24: men | M24: 14
B25: 19 | C25: Steve Katz | D25: =J25-I25 -> 8.8530092592592591E-2 | E25: 4.9768518518518517E-2 | F25: =RANK(E25,E$7:E$36,1) -> 23 | G25: 3.876157407407408E-2 | H25: =RANK(G25,G$7:G$36,1) -> 14 | I25: 0 | J25: =E25+G25 -> 8.8530092592592591E-2 | K25: =RANK(J25,J$7:J$36,1) -> 17 | L25: men | M25: 15
B26: =B25+1 -> 20 | C26: Doug Armstrong | D26: =J26-I26 -> 8.8599537037037032E-2 | E26: 5.1342592592592586E-2 | F26: =RANK(E26,E$7:E$36,1) -> 28 | G26: 3.7256944444444447E-2 | H26: =RANK(G26,G$7:G$36,1) -> 11 | I26: 0 | J26: =E26+G26 -> 8.8599537037037032E-2 | K26: =RANK(J26,J$7:J$36,1) -> 18 | L26: men | M26: 16
B27: =B26+1 -> 21 | C27: Karen Steele | D27: =J27-I27 -> 8.8773148148148157E-2 | E27: 4.8020833333333339E-2 | F27: =RANK(E27,E$7:E$36,1) -> 20 | G27: 5.1168981481481489E-2 | H27: =RANK(G27,G$7:G$36,1) -> 27 | I27: 1.0416666666666666E-2 | J27: =E27+G27 -> 9.9189814814814828E-2 | K27: =RANK(J27,J$7:J$36,1) -> 27 | L27: women | M27: 4
B28: =B27+1 -> 22 | C28: Bill Neer | D28: =J28-I28 -> 8.8784722222222223E-2 | E28: 5.0312500000000003E-2 | F28: =RANK(E28,E$7:E$36,1) -> 26 | G28: 3.847222222222222E-2 | H28: =RANK(G28,G$7:G$36,1) -> 13 | I28: 0 | J28: =E28+G28 -> 8.8784722222222223E-2 | K28: =RANK(J28,J$7:J$36,1) -> 19 | L28: men | M28: 17
B29: =B28+1 -> 23 | C29: Nick Wilton | D29: =J29-I29 -> 8.9525462962962959E-2 | E29: 4.3692129629629629E-2 | F29: =RANK(E29,E$7:E$36,1) -> 10 | G29: 4.5833333333333337E-2 | H29: =RANK(G29,G$7:G$36,1) -> 26 | I29: 0 | J29: =E29+G29 -> 8.9525462962962959E-2 | K29: =RANK(J29,J$7:J$36,1) -> 21 | L29: men | M29: 18
B30: 23 | C30: David Bronstein | D30: =J30-I30 -> 8.9525462962962959E-2 | E30: 4.3888888888888887E-2 | F30: =RANK(E30,E$7:E$36,1) -> 11 | G30: 4.5636574074074072E-2 | H30: =RANK(G30,G$7:G$36,1) -> 25 | I30: 0 | J30: =E30+G30 -> 8.9525462962962959E-2 | K30: =RANK(J30,J$7:J$36,1) -> 21 | L30: men | M30: 18
B31: 25 | C31: Kevin O’Donnell | D31: =J31-I31 -> 9.1319444444444439E-2 | E31: 4.7534722222222221E-2 | F31: =RANK(E31,E$7:E$36,1) -> 18 | G31: 4.3784722222222218E-2 | H31: =RANK(G31,G$7:G$36,1) -> 23 | I31: 0 | J31: =E31+G31 -> 9.1319444444444439E-2 | K31: =RANK(J31,J$7:J$36,1) -> 23 | L31: men | M31: 20
B32: =B31+1 -> 26 | C32: Mike Lotter | D32: =J32-I32 -> 9.5300925925925928E-2 | E32: 4.9976851851851856E-2 | F32: =RANK(E32,E$7:E$36,1) -> 25 | G32: 4.5324074074074072E-2 | H32: =RANK(G32,G$7:G$36,1) -> 24 | I32: 0 | J32: =E32+G32 -> 9.5300925925925928E-2 | K32: =RANK(J32,J$7:J$36,1) -> 25 | L32: men | M32: 21
B33: =B32+1 -> 27 | C33: Todd Ritola | D33: =J33-I33 -> 9.8784722222222218E-2 | E33: 5.6377314814814818E-2 | F33: =RANK(E33,E$7:E$36,1) -> 29 | G33: 4.2407407407407401E-2 | H33: =RANK(G33,G$7:G$36,1) -> 21 | I33: 0 | J33: =E33+G33 -> 9.8784722222222218E-2 | K33: =RANK(J33,J$7:J$36,1) -> 26 | L33: men | M33: 22
B34: =B33+1 -> 28 | C34: Stephen Tracy | D34: =J34-I34 -> 0.10548611111111111 | E34: 4.7523148148148148E-2 | F34: =RANK(E34,E$7:E$36,1) -> 17 | G34: 5.7962962962962959E-2 | H34: =RANK(G34,G$7:G$36,1) -> 29 | I34: 0 | J34: =E34+G34 -> 0.10548611111111111 | K34: =RANK(J34,J$7:J$36,1) -> 28 | L34: men | M34: 23
B35: =B34+1 -> 29 | C35: Janet Bowman | D35: =J35-I35 -> 0.10488425925925925 | E35: 5.7453703703703701E-2 | F35: =RANK(E35,E$7:E$36,1) -> 30 | G35: 5.7847222222222223E-2 | H35: =RANK(G35,G$7:G$36,1) -> 28 | I35: 1.0416666666666666E-2 | J35: =E35+G35 -> 0.11530092592592592 | K35: =RANK(J35,J$7:J$36,1) -> 29 | L35: women | M35: 5
B36: =B35+1 -> 30 | C36: Hans Schmid | D36: =J36-I36 -> 0.13111111111111112 | E36: 4.9861111111111113E-2 | F36: =RANK(E36,E$7:E$36,1) -> 24 | G36: 8.1250000000000003E-2 | H36: =RANK(G36,G$7:G$36,1) -> 30 | I36: 0 | J36: =E36+G36 -> 0.13111111111111112 | K36: =RANK(J36,J$7:J$36,1) -> 30 | L36: men | M36: 24
B38: Notes: | C38: Roy changed the rules after the women started. Otherwise Jamie would have won outright.
C39: Tomas became the first known swimmer in a DBICCR. It propelled him to a stellar 7th place overall. *
C40: * Everyone knows you're not supposed to swim on the mountain, and Tomas would never break the rules, so of course this is fictitious.